Timestamp,tweet_text,Username,User_loc,All_hashtags,UserID_verified,followers_count
2020-09-07 01:41:01,b'Cryptojacking schema via https://t.co/hKvyeqYvhT #Infosec #CyberSecurity #CyberAttack #Hack #Breach #Threat #DDoS #Malware #Ransomware #Cyberwarning #Phishing #SpyWare #Tech #Technology https://t.co/Tq4OoiH3gC',b'CioAmaro',b'M\xc3\xa9xico',"['Infosec', 'CyberSecurity', 'CyberAttack', 'Hack', 'Breach', 'Threat', 'DDoS', 'Malware', 'Ransomware', 'Cyberwarning', 'Phishing', 'SpyWare', 'Tech', 'Technology']",False,8412
2020-09-07 00:49:06,b'Types of cyberattacks #infosec #cybersecurity #hack #threat #malware #phishing #vulnerability #risk #tech #technology #incident #spyware #breach #CyberAttack https://t.co/6sZbZfQak1',b'CioAmaro',b'M\xc3\xa9xico',"['infosec', 'cybersecurity', 'hack', 'threat', 'malware', 'phishing', 'vulnerability', 'risk', 'tech', 'technology', 'incident', 'spyware', 'breach', 'CyberAttack']",False,8412
2020-09-07 00:13:28,b'@thehill @AndrewYang That seems to be the only  #Threat the @DNC has left to try and gain control of America \xf0\x9f\x98\xb3',b'AmericanCente14',b'Washington DC',['Threat'],False,456
2020-09-06 23:14:30,"b'and i DO NOT GIVE A FLYING FUCK if the #children are born or unborn, @zaynmalik--moreover, @GiGiHadid? if it sounds like a #threat? IT PROBABLY IS ONE. stop fucking #LYING. why? BECAUSE THERE IS FUCKING #SHAKTI AGAIN WITH LITERALLY PERFECT TIMING &amp; POSITIONING. \xf0\x9f\x98\xbd\xe2\x9c\xa8 #ALWAYSwins https://t.co/mMs0RYsmoB'",b'tookwancottage',b'#innernorth of the Wurundjeri',"['children', 'threat', 'LYING', 'SHAKTI', 'ALWAYSwins']",False,486
2020-09-06 23:03:01,b'The Value of a Hacked Email Account \xe2\x80\x94 Krebs on Security  by @briankrebs #Infosec #CyberSecurity #CyberAttack #Hack #Breach #Threat #DDoS #Malware #Ransomware #Cyberwarning #Phishing #SpyWare #Tech #Technology #Tech_1k @CioAmaro #email https://t.co/No7xxOYVS1',b'CioAmaro',b'M\xc3\xa9xico',"['Infosec', 'CyberSecurity', 'CyberAttack', 'Hack', 'Breach', 'Threat', 'DDoS', 'Malware', 'Ransomware', 'Cyberwarning', 'Phishing', 'SpyWare', 'Tech', 'Technology', 'Tech_1k', 'email']",False,8412
2020-09-06 22:11:01,b'Zero day attack timeline via https://t.co/hKvyeqYvhT #Infosec #CyberSecurity #CyberAttack #Hack #Breach #Threat #DDoS #Malware #Ransomware #Cyberwarning #Phishing #SpyWare #Tech #Technology https://t.co/91Vfmu4D5J',b'CioAmaro',b'M\xc3\xa9xico',"['Infosec', 'CyberSecurity', 'CyberAttack', 'Hack', 'Breach', 'Threat', 'DDoS', 'Malware', 'Ransomware', 'Cyberwarning', 'Phishing', 'SpyWare', 'Tech', 'Technology']",False,8412
2020-09-06 22:06:18,"b'The rising number of #COVID19 #patient in #India is whooping as much as 1 million in just 10 days, COVID #Situation in India has become a bomb about to be exploded, a great #threat to its #neighbouring #countries and the world'",b'ziadin75',b'Islamabad',"['COVID19', 'patient', 'India', 'Situation', 'threat', 'neighbouring', 'countries']",False,538
2020-09-06 22:01:58,b'#Pentagon: #Chinese Air #Force fast-becoming massive #threat  https://t.co/037du5dMOs',b'TulipPenney',b'Canberra',"['Pentagon', 'Chinese', 'Force', 'threat']",False,95668
2020-09-06 21:40:02,b'Illustrated History of Cybercrime by Cybersecurity Ventures via Cybercrime Magazine #Infosec #CyberSecurity #CyberAttack #Hacking #Privacy #Threat #Malware #Ransomware #Cyberwarning #Phishing #SpyWare #Tech #Technology  #cybercrime https://t.co/D5X9kqPYVc',b'CioAmaro',b'M\xc3\xa9xico',"['Infosec', 'CyberSecurity', 'CyberAttack', 'Hacking', 'Privacy', 'Threat', 'Malware', 'Ransomware', 'Cyberwarning', 'Phishing', 'SpyWare', 'Tech', 'Technology', 'cybercrime']",False,8412
2020-09-06 20:50:53,"b""Sto-ology: #Facebook's role in #Brexit \xe2\x80\x94 and the #threat to #... https://t.co/hJljv9ifbp""",b'Sto_ology',b'NYC',"['Facebook', 'Brexit', 'threat']",False,787
2020-09-06 20:50:50,b'The Election Security Drills States Need to Be Doing Right Now @StateTech #election2020 #statetech phishing #security #Malware #Ransomware #100daysofcode #Infosec #CyberSecurity #CyberAttack #Hacking #Threat #Ransomware #Cyberwarning #Phishing #cdwsocial https://t.co/EtGeAcwoI5',b'CDWGWAGov',"b'Bellevue, WA'","['election2020', 'statetech', 'security', 'Malware', 'Ransomware', '100daysofcode', 'Infosec', 'CyberSecurity', 'CyberAttack', 'Hacking', 'Threat', 'Ransomware', 'Cyberwarning', 'Phishing', 'cdwsocial']",False,8299
2020-09-06 20:21:28,"b'Don\'t forget #mentalhealth laws, ""if you\'re a #threat to yourself or others"". If someone threatens your life or lies about you, you have the right to have that #bully locked up for a #psychiatric #evalution. Oppressors are #ruthless, so play their own game, but better.\xf0\x9f\x98\x8e https://t.co/9olAVWL9WN'",b'soniamjain',b'Finland',"['mentalhealth', 'threat', 'bully', 'psychiatric', 'evalution', 'ruthless']",False,1910
2020-09-06 20:10:03,"b'How threats can figure into the IT, OT, and IP convergence via Trend Micro USA  #Infographic #Infosec #CyberSecurity #CyberAttack #Hack #Breach #Threat #DDoS #Malware #Cyberwarning #Phishing #SpyWare #Tech #Technology #Tech_1k @CioAmaro #IoT #OT #Industry40 #IIoT #IoTPL https://t.co/uU24ZxXAYC'",b'CioAmaro',b'M\xc3\xa9xico',"['Infographic', 'Infosec', 'CyberSecurity', 'CyberAttack', 'Hack', 'Breach', 'Threat', 'DDoS', 'Malware', 'Cyberwarning', 'Phishing', 'SpyWare', 'Tech', 'Technology', 'Tech_1k', 'IoT', 'OT', 'Industry40', 'IIoT', 'IoTPL']",False,8412
2020-09-06 20:04:22,b'Finally Got Some Sleep Now Edit Course with My Blankita BDE Fym #threat #LaFamilaOT #BeTheThreat https://t.co/v765rOYPaA',b'Aim_Szn',"b'Manhattan, New YorK'","['threat', 'LaFamilaOT', 'BeTheThreat']",False,301
2020-09-06 20:02:06,"b'Uh oh, the only threat to Novak Djokovic May be himself at the #USOpen He\xe2\x80\x99s back on the court now.  @lockerroomapp #novakdjokovic #injured #risk #threat #Tennis #USOpen2020 #serbia #lockerroomapp https://t.co/ICJI60eisL'",b'Bruthasontennis',b'',"['USOpen', 'novakdjokovic', 'injured', 'risk', 'threat', 'Tennis', 'USOpen2020', 'serbia', 'lockerroomapp']",False,44
2020-09-06 19:33:02,"b'@kirstiealley @hoffman_diane This is an absolute #Threat by @SenKamalaHarris against more than half of the U.S.A. She needs to be arrested, prosecuted and sent to prison, hopefully in #GITMO!'",b'butch_hoffman',"b'Phoenix, AZ'","['Threat', 'GITMO']",False,2776
2020-09-06 19:12:03,b'43 COVID-19 Cybersecurity Statistics - Panda Security Mediacenter  #Infosec #CyberSecurity #CyberAttack #Hacking #Privacy #Threat #Malware #Ransomware #Cyberwarning #Phishing #SpyWare #Tech #Technology https://t.co/PioPx7GmJe',b'CioAmaro',b'M\xc3\xa9xico',"['Infosec', 'CyberSecurity', 'CyberAttack', 'Hacking', 'Privacy', 'Threat', 'Malware', 'Ransomware', 'Cyberwarning', 'Phishing', 'SpyWare', 'Tech', 'Technology']",False,8412
2020-09-06 19:00:58,b'@FinancialTimes @nsitharamanoffc @PMOIndia @IndianExpress  most shameless act seen today India is giving birth to such a creeped woman   #threat given to bank employees for fake RAPE case just because they went for loan recovery  https://t.co/2YElGZiFSI',b'palki_shri',b'bangalore',['threat'],False,16
2020-09-06 18:24:01,b'Back to basis  Difference Between Malware And Virus  #Infosec #CyberSecurity #CyberAttack #Hack #Breach #Threat #DDoS #Malware #Ransomware #Cyberwarning #Phishing #SpyWare #Tech #Technology https://t.co/Hmp4YXq4m1',b'CioAmaro',b'M\xc3\xa9xico',"['Infosec', 'CyberSecurity', 'CyberAttack', 'Hack', 'Breach', 'Threat', 'DDoS', 'Malware', 'Ransomware', 'Cyberwarning', 'Phishing', 'SpyWare', 'Tech', 'Technology']",False,8412
2020-09-06 17:30:33,"b""Welcome to #JoeBiden's #America ! #WakeUpaamerica.. he has done nothing to curb this Dem city violence, other than a #threat it will get worse if you vote for @realDonaldTrump.  We know after the election is over Trump will send in the national guard to arrest these #terrorists! https://t.co/anBI0RxsDU""",b'ToddJobson',b'NJ',"['JoeBiden', 'America', 'WakeUpaamerica', 'threat', 'terrorists']",False,1843
2020-09-06 17:23:32,"b'Time to #WakeUp &amp; realize magnitude of situation we are in, &amp; the #Threat to our #Democracy. - Can\xe2\x80\x99t sit &amp; passively be disengaged - If there was EVER a time to be #Engaged &amp; #TakeAction this is it - #Vote Call write tweet meet with representatives #ThreatToDemocracy @AmerIndivis https://t.co/G46p5xGbh1'",b'Starbright489',"b'Pennsylvania, USA'","['WakeUp', 'Threat', 'Democracy', 'Engaged', 'TakeAction', 'Vote', 'ThreatToDemocracy']",False,96
2020-09-06 17:07:02,b'Tips for Spotting SMishing and Vishing by Infosec Institute #Infosec #CyberSecurity #CyberAttack #Hacking #Privacy #Threat #Malware #Ransomware #Cyberwarning #Phishing #SpyWare #Tech #Technology https://t.co/Ap15qlbhnW',b'CioAmaro',b'M\xc3\xa9xico',"['Infosec', 'CyberSecurity', 'CyberAttack', 'Hacking', 'Privacy', 'Threat', 'Malware', 'Ransomware', 'Cyberwarning', 'Phishing', 'SpyWare', 'Tech', 'Technology']",False,8412
2020-09-06 16:28:16,b'@CalebKorinya @machomario3 #Treat in place of #Threat??? Now I give up on this set of people...',b'JhayDjovic',"b""God's favorite place on Earth""","['Treat', 'Threat']",False,348
2020-09-06 16:16:04,b'Common Types of Phishing Attacks by Infosec Institute #Infosec #CyberSecurity #CyberAttack #Hacking #Privacy #Threat #Malware #Ransomware #Cyberwarning #Phishing #SpyWare #Tech #Technology https://t.co/XexYPcwFil',b'CioAmaro',b'M\xc3\xa9xico',"['Infosec', 'CyberSecurity', 'CyberAttack', 'Hacking', 'Privacy', 'Threat', 'Malware', 'Ransomware', 'Cyberwarning', 'Phishing', 'SpyWare', 'Tech', 'Technology']",False,8412
2020-09-06 16:00:46,b'Research Casts Doubt on Value of Threat Intel Feeds https://t.co/OJRjt4U0It @DarkReading #threat-intel',b'mindfluence',"b'Chicago, IL'",['threat'],False,70
2020-09-06 15:45:02,b'Cyber Warfare Infographic from Valdai Discussion Club #Infosec #CyberSecurity #CyberAttack #Hack #Breach #Threat #DDoS #Malware #Ransomware #Cyberwarning #Phishing #SpyWare #Tech #Technology #Tech_1k @CioAmaro https://t.co/JqaGYK46yp',b'CioAmaro',b'M\xc3\xa9xico',"['Infosec', 'CyberSecurity', 'CyberAttack', 'Hack', 'Breach', 'Threat', 'DDoS', 'Malware', 'Ransomware', 'Cyberwarning', 'Phishing', 'SpyWare', 'Tech', 'Technology', 'Tech_1k']",False,8412
2020-09-06 14:37:23,b'Check out the full complaint by #FBI on a #ransomware attack attempt on #Tesla Insider #threat are always a thing to be feared and taken caution of.   #infosec #threatintel   https://t.co/JaG1Y3Yrup',b'TheD4RKr3ap3r',b'127.0.0.1',"['FBI', 'ransomware', 'Tesla', 'threat', 'infosec', 'threatintel']",False,319
2020-09-06 14:29:11,b'Birmingham stabbings: Manhunt as one killed and seven hurt via @BBCWorld | #violence #attack #stabbings #manhunt #highthreat #threat #publicsafety #response #BirminghamStabbings #attacks #search  https://t.co/xErhN0FlYu',b'HT_Resp',b'',"['violence', 'attack', 'stabbings', 'manhunt', 'highthreat', 'threat', 'publicsafety', 'response', 'BirminghamStabbings', 'attacks', 'search']",False,104
2020-09-06 14:28:01,b'biggest perceived risks/concerns internally according AT&amp;T Cybersecurity #Infosec #CyberSecurity #CyberAttack #Hacking #Privacy #Threat #Malware #Ransomware #Cyberwarning #Phishing #SpyWare #Tech #Technology https://t.co/tfp3LsExxC',b'CioAmaro',b'M\xc3\xa9xico',"['Infosec', 'CyberSecurity', 'CyberAttack', 'Hacking', 'Privacy', 'Threat', 'Malware', 'Ransomware', 'Cyberwarning', 'Phishing', 'SpyWare', 'Tech', 'Technology']",False,8412
2020-09-06 13:57:44,"b'#Maharashtra #CM received four #threat #calls from allegedly #Dawood gang. Is it a #ploy to garner sympathy for the CM whose stature has suffered a huge dent following the #SSR case goof up by #Mumbai #police?  Anything goes in politics, dear friends. SharadPawar controls Dawood.'",b'EkDesiBhai',b'',"['Maharashtra', 'CM', 'threat', 'calls', 'Dawood', 'ploy', 'SSR', 'Mumbai', 'police']",False,225
2020-09-06 13:57:08,b'Maharashtra CM Uddhav Thackeray\xe2\x80\x99s Residence \xe2\x80\x98Matoshree\xe2\x80\x99s\xe2\x80\x99 Security Beefed Up After Suspicious Calls Recieved https://t.co/RgnnyS3FIZ #Maharashtra #UddhavThackeray #Threat #security',b'latestly',"b'Mumbai, India'","['Maharashtra', 'UddhavThackeray', 'Threat', 'security']",True,64333
2020-09-06 13:25:28,b'@WIONews China is now becoming threat to South Asia even Russia \xf0\x9f\x87\xb7\xf0\x9f\x87\xba for sure . We Indians should start a campaign on this ...#China #threat #worldwide',b'newsbreakasia',b'South Asia',"['China', 'threat', 'worldwide']",False,80
2020-09-06 13:15:00,b'Almonds are massively treated with a herbicide fatal to bees and carcinogenic to humans. #bees #almonds #threat #extinction #honeybees #agriculture #pollination #environment #nature #glyphosphate #deadly #biodiversity #ecology #science #news #industry  https://t.co/Q4mtCcHyp2',b'interestinfeed',"b'New York, USA'","['bees', 'almonds', 'threat', 'extinction', 'honeybees', 'agriculture', 'pollination', 'environment', 'nature', 'glyphosphate', 'deadly', 'biodiversity', 'ecology', 'science', 'news', 'industry']",False,496
2020-09-06 12:08:36,"b'First of all why Dawood or his guy wants to blow up our @CMOMaharashtra House?  That too, all of sudden?  Or somebody wants to divert us to this?  Increase in security is vital but unmasking the agenda of the caller is crucial.  Nation is going through very tough time.  #Threat https://t.co/Lz5TRk695r'",b'ShafakatK',b'India',['Threat'],False,290
2020-09-06 12:03:56,b'#extreme #wildfire #threat  west of the #cascades \xf0\x9f\x94\xa5 #becareful #StayAlert #StaySafe https://t.co/k7GrsrVSxM',b'coni12thwoman',b'United States',"['extreme', 'wildfire', 'threat', 'cascades', 'becareful', 'StayAlert', 'StaySafe']",False,777
2020-09-06 12:03:34,"b""#America has a problem and IT IS NOT #COVID19.  Don't ever ask yourself why the USA is in state of #Hate  that it is.  If this is true @SenKamalaHarris made blanket #threat against @realDonaldTrump supporters; will no doubt incite further violence if she makes it to #WhiteHouse https://t.co/7YLoByzQdj""",b'rhonda_mangus',b'New York',"['America', 'COVID19', 'Hate', 'threat', 'WhiteHouse']",False,2009
2020-09-06 11:35:31,b'The root cause behind all US Coast Guard efforts to raise awareness of imminent #cyber threats is the expanding maritime cyber #threat landscape because of the proliferation of emerging technologies and the #digitalization of devices onboard vessels. https://t.co/42euWQb3lj',b'apkasac',b'India',"['cyber', 'threat', 'digitalization']",False,111
2020-09-06 10:43:54,b'#Postmaster General sabotaged USPS #election #tampering GOP governors/mayors #voter #suppression #oppression #voter rights violations of minorities #Blacks #Native Americans #Hispanics #un-Constitutional voter laws #Trump claim election rigged #threat to start Civil War if loses',b'LesterS38734894',b'',"['Postmaster', 'election', 'tampering', 'voter', 'suppression', 'oppression', 'voter', 'Blacks', 'Native', 'Hispanics', 'un', 'Trump', 'threat']",False,1412
2020-09-06 10:37:59,"b""#People #Hate #Reasons #Threat #Love #Ourselves #DontHate #Strengthfor2day People hate for 1 of 3 reasons. 1) They hate themselves 2) They want to be us 3) They see us as a Threat When we love ourselves we are incapable of hating anyone no matter what they've done. https://t.co/uZtwlgnpUO""",b'Strengthfor2day',b'',"['People', 'Hate', 'Reasons', 'Threat', 'Love', 'Ourselves', 'DontHate', 'Strengthfor2day']",False,722
2020-09-06 10:01:29,"b'52% of breaches featured hacking, 28% involved malware and 32\xe2\x80\x9333% included phishing or social engineering, respectively.  Would you like to have proactive cyber security that has never been breached? Visit us and request.   #cybersecurity #cybershield #cyberrisks #threat #breach https://t.co/0r38SBThVi'",b'AmaniAaldosari',"b'Doha, Qatar'","['cybersecurity', 'cybershield', 'cyberrisks', 'threat', 'breach']",False,1047
2020-09-06 09:21:52,"b'1/2 \xe2\x80\x9cI think in many ways that we #autistic are the normal ones and that the rest of the people are pretty strange, especially when it comes to the sustainability crisis, where everyone keeps saying that #ClimateChange is an #existential #threat and the most important issue of...'",b'deryckvs',"b'London, England'","['autistic', 'ClimateChange', 'existential', 'threat']",False,455
2020-09-06 09:07:04,b'What A Threat Analyst Really Thinks of Intelligence #cybersecurity #threat #message https://t.co/WxMDZEP7A7',b'hintz2010',"b'Zug, Schweiz'","['cybersecurity', 'threat', 'message']",False,281
2020-09-06 07:09:20,b'Good examples of #threat genre to work on. @TanyaKaroli @SuneAuken do text veiled threats and visual veiled threats belong to the same #genre? #ForensicLinguistics https://t.co/24KUNOO8JL',b'DrPicornell',b'Bailiwick of Guernsey',"['threat', 'genre', 'ForensicLinguistics']",False,508
2020-09-06 06:37:24,"b'Via @mclynd #Ransomware Is A Global #Threat That Requires A Coordinated, Global Response - @Forbes https://t.co/xHEjTLvXas  @edans @nigewillson @JBarbosaPR @Dahl_Consult @DrJDrooghaag @IanLJones98 @ShiCooks @CyrilCoste #ZeroTrust #ClSO #Cybersecurity #IoT https://t.co/I6FO6eJeY4'",b'Bernardo_Pirola',b'',"['Ransomware', 'Threat', 'ZeroTrust', 'ClSO', 'Cybersecurity', 'IoT']",False,2035
2020-09-06 05:53:22,"b'#Cyber #Threat #Intelligence will help Cybersecurity analyst in understanding cyber threats clearly and precisely. This will improve the response rate and canvalso help focus on actual security threats. Thus, the efficiency of your security team will automatically improve. https://t.co/E5okQyf9O4'",b'bijaysenihang',b'Nepal',"['Cyber', 'Threat', 'Intelligence']",False,1017
2020-09-06 05:52:22,"b'#Cyber #Threat #Intelligence will help Cybersecurity analyst in understanding cyber threats clearly and precisely. This will improve the response rate and canvalso help focus on actual security threats. Thus, the efficiency of your security team will automatically improve. https://t.co/RXUtop031d'",b'bijaysenihang',b'Nepal',"['Cyber', 'Threat', 'Intelligence']",False,1017
2020-09-06 05:43:13,b'#Drones and #Terrorism: #Asymmetric #warfare and the #threat to #Global #Security https://t.co/nAFrq0bdWU https://t.co/PO97MAoxC7',b'guarda_privados',b'UAE',"['Drones', 'Terrorism', 'Asymmetric', 'warfare', 'threat', 'Global', 'Security']",False,13679
2020-09-06 05:39:49,"b'#WhiteSupremacist #extremists will pose the most persistent and lethal threat,\xe2\x80\x9d states a draft report by the Department of Homeland Security, according to Politico. https://t.co/F7tHLdgs6A #Racism is the #Threat , not #Antifa #BLMprotest #Socialism . #Trump &amp; @Gop are doing zero'",b'juliuslumsden1',b'California & United Kingdom ',"['WhiteSupremacist', 'extremists', 'Racism', 'Threat', 'Antifa', 'BLMprotest', 'Socialism', 'Trump']",False,1139
2020-09-06 05:34:15,"b'#Occupy: The US is the leading #Rogue state &amp; main #Threat to international stability &amp; peace. Its complete disregard for international #Law, peaceful cohabitation &amp; diplomacy has been exposed.  How to End America\xe2\x80\x99s Destructive Hegemony:  via @FortRussNews https://t.co/izpuLsV3US'",b'OccupySchagen',b'Schagen The Netherlands',"['Occupy', 'Rogue', 'Threat', 'Law']",False,9183
2020-09-06 04:28:10,b'Cod Fall Guys and maybe Fort need a break from it no sleep 24 plus hrs light BDE Fym #threat #LaFamilaOT #BeTheThreat https://t.co/v765rOYPaA',b'Aim_Szn',"b'Manhattan, New YorK'","['threat', 'LaFamilaOT', 'BeTheThreat']",False,301
2020-09-06 04:02:13,"b'@airnewsalerts China is an biggest #threat to the complete #Humanity &amp; to the #WholeWorld. All #Nation around #world shud Unite together against China &amp; Boycott China. Need #USA, #Russia, #ISRAIL, #India,#arabcountries, #Japan, #UK, #Korea, etc.. all shud stand together #united to warn China.'",b'RNJ53',b'',"['threat', 'Humanity', 'WholeWorld', 'Nation', 'world', 'USA', 'Russia', 'ISRAIL', 'India', 'arabcountries', 'Japan', 'UK', 'Korea', 'united']",False,0
2020-09-06 03:51:05,"b'@Swamy39 China is an biggest #threat to the complete #Humanity &amp; to the #WholeWorld. All #Nation around #world shud Unite together against China &amp; Boycott China. Need #USA, #Russia, #ISRAIL, #India,#arabcountries, #Japan, #UK, #Korea, etc.. all shud stand together #united to warn China.'",b'RNJ53',b'',"['threat', 'Humanity', 'WholeWorld', 'Nation', 'world', 'USA', 'Russia', 'ISRAIL', 'India', 'arabcountries', 'Japan', 'UK', 'Korea', 'united']",False,0
2020-09-06 03:50:53,"b'@htTweets @rajnathsingh China is an biggest #threat to the complete #Humanity &amp; to the #WholeWorld. All #Nation around #world shud Unite together against China &amp; Boycott China. Need #USA, #Russia, #ISRAIL, #India,#arabcountries, #Japan, #UK, #Korea, etc.. all shud stand together #united to warn China.'",b'RNJ53',b'',"['threat', 'Humanity', 'WholeWorld', 'Nation', 'world', 'USA', 'Russia', 'ISRAIL', 'India', 'arabcountries', 'Japan', 'UK', 'Korea', 'united']",False,0
2020-09-06 03:49:41,"b'@INCIndia China is an biggest #threat to the complete #Humanity &amp; to the #WholeWorld. All #Nation around #world shud Unite together against China &amp; Boycott China. Need #USA, #Russia, #ISRAIL, #India,#arabcountries, #Japan, #UK, #Korea, etc.. all shud stand together #united to warn China.'",b'RNJ53',b'',"['threat', 'Humanity', 'WholeWorld', 'Nation', 'world', 'USA', 'Russia', 'ISRAIL', 'India', 'arabcountries', 'Japan', 'UK', 'Korea', 'united']",False,0
2020-09-06 03:48:24,"b'@PMOIndia China is an biggest #threat to the complete #Humanity &amp; to the #WholeWorld. All #Nation around #world shud Unite together against China &amp; Boycott China. Need #USA, #Russia, #ISRAIL, #India,#arabcountries, #Japan, #UK, #Korea, etc.. all shud stand together #united to warn China.'",b'RNJ53',b'',"['threat', 'Humanity', 'WholeWorld', 'Nation', 'world', 'USA', 'Russia', 'ISRAIL', 'India', 'arabcountries', 'Japan', 'UK', 'Korea', 'united']",False,0
2020-09-06 03:45:51,"b'@realDonaldTrump China is an biggest #threat to the complete #Humanity &amp; to the #WholeWorld. All #Nation around #world shud Unite together against China &amp; Boycott China. Need #USA, #Russia, #ISRAIL, #India,#arabcountries, #Japan, #UK, #Korea, etc.. all shud stand together #united to warn China.'",b'RNJ53',b'',"['threat', 'Humanity', 'WholeWorld', 'Nation', 'world', 'USA', 'Russia', 'ISRAIL', 'India', 'arabcountries', 'Japan', 'UK', 'Korea', 'united']",False,0
2020-09-06 03:45:30,"b'@realDonaldTrump China is an biggest #threat to the complete #Humanity &amp; to the #WholeWorld. All #Nation around #world shud Unite together against China &amp; Boycott China. Need #USA, #Russia, #ISRAIL, #India,#arabcountries, #Japan, #UK, #Korea, etc.. all shud stand together #united to warn China.'",b'RNJ53',b'',"['threat', 'Humanity', 'WholeWorld', 'Nation', 'world', 'USA', 'Russia', 'ISRAIL', 'India', 'arabcountries', 'Japan', 'UK', 'Korea', 'united']",False,0
2020-09-06 03:44:17,"b'@Ravinder536R @Swamy39 China is an biggest #threat to the complete #Humanity &amp; to the #WholeWorld. All #Nation around #world shud Unite together against China &amp; Boycott China. Need #USA, #Russia, #ISRAIL, #India,#arabcountries, #Japan, #UK, #Korea, etc.. all shud stand together #united to warn China.'",b'RNJ53',b'',"['threat', 'Humanity', 'WholeWorld', 'Nation', 'world', 'USA', 'Russia', 'ISRAIL', 'India', 'arabcountries', 'Japan', 'UK', 'Korea', 'united']",False,0
2020-09-06 03:22:56,b'09 Vibes tonight maybe early 2000s but Arena Grind no sleep 24 plus hrs light BDE Fym #threat #LaFamilaOT #BeTheThreat https://t.co/v765rOYPaA',b'Aim_Szn',"b'Manhattan, New YorK'","['threat', 'LaFamilaOT', 'BeTheThreat']",False,301
2020-09-06 03:19:27,"b'@waltshaub Time to #WakeUp &amp; realize magnitude of situation we are in, &amp; the #Threat to our #Democracy. - Can\xe2\x80\x99t sit &amp; passively be disengaged - If there was EVER a time to be #Engaged &amp; #TakeAction this is it - #Vote Call write tweet meet with representatives #ThreatToDemocracy @AmerIndivis'",b'Starbright489',"b'Pennsylvania, USA'","['WakeUp', 'Threat', 'Democracy', 'Engaged', 'TakeAction', 'Vote', 'ThreatToDemocracy']",False,96
2020-09-06 03:12:14,b'#Drones and #Terrorism: #Asymmetric #warfare and the #threat to #Global #Security https://t.co/nAFrq0bdWU https://t.co/G5Z0M227Hu',b'guarda_privados',b'UAE',"['Drones', 'Terrorism', 'Asymmetric', 'warfare', 'threat', 'Global', 'Security']",False,13679
2020-09-06 03:12:05,b'#Drones and #Terrorism: #Asymmetric #warfare and the #threat to #Global #Security https://t.co/nAFrq0bdWU https://t.co/e1AT3vCNT0',b'guarda_privados',b'UAE',"['Drones', 'Terrorism', 'Asymmetric', 'warfare', 'threat', 'Global', 'Security']",False,13679
2020-09-06 03:11:47,b'#Drones and #Terrorism: #Asymmetric #warfare and the #threat to #Global #Security https://t.co/nAFrq0bdWU https://t.co/Sglw0Ed9oZ',b'guarda_privados',b'UAE',"['Drones', 'Terrorism', 'Asymmetric', 'warfare', 'threat', 'Global', 'Security']",False,13679
2020-09-06 03:11:40,b'#Drones and #Terrorism: #Asymmetric #warfare and the #threat to #Global #Security https://t.co/nAFrq0bdWU https://t.co/H6IQppMdB2',b'guarda_privados',b'UAE',"['Drones', 'Terrorism', 'Asymmetric', 'warfare', 'threat', 'Global', 'Security']",False,13679
2020-09-06 03:11:28,b'#Drones and #Terrorism: #Asymmetric #warfare and the #threat to #Global #Security https://t.co/nAFrq0bdWU https://t.co/qCgDyzo50R',b'guarda_privados',b'UAE',"['Drones', 'Terrorism', 'Asymmetric', 'warfare', 'threat', 'Global', 'Security']",False,13679
2020-09-06 03:01:44,b'#Drones and #Terrorism: #Asymmetric #warfare and the #threat to #Global #Security https://t.co/nAFrq0bdWU',b'guarda_privados',b'UAE',"['Drones', 'Terrorism', 'Asymmetric', 'warfare', 'threat', 'Global', 'Security']",False,13679
