Timestamp,tweet_text,Username,User_loc,All_hashtags,UserID_verified,followers_count
2020-09-12 09:08:39,"b""https://t.co/y7CRBRgU28  @PMCPune @SmartPune @PCMCSarathi @AjitPawarSpeaks @IAS_Rubal @MoHFW_INDIA @mohol_murlidhar   Pathetic situation for rural people as they are declined by the hospital and shocked to see Pune's #hospital do not have #bed available. Big #Threat to #Punekar""",b'KapilSawakare',"b'Pune, India.'","['hospital', 'bed', 'Threat', 'Punekar']",False,617
2020-09-12 07:34:56,b'Boris #Johnson: #EU a #threat to #integrity of the #UK -   https://t.co/xT0okt1EwI',b'CGH54',b'UK- Wales',"['Johnson', 'EU', 'threat', 'integrity', 'UK']",False,2024
2020-09-12 07:26:45,"b'BIPSS realizes that to understand the threat of #radicalization in #Bangladesh, it is essential to know the #trends of #femaleradicalization, the imminent #threat of it in #PostPandemic time &amp; lastly finding approaches to counter radicalization through #Genderlens #WebinarofBIPSS https://t.co/i6gFmkp2el'",b'bipss',"b'Dhaka, Bangladesh'","['radicalization', 'Bangladesh', 'trends', 'femaleradicalization', 'threat', 'PostPandemic', 'Genderlens', 'WebinarofBIPSS']",False,1312
2020-09-12 06:28:35,"b'*FLASH*  03 AK47, 02 M16 Rifles, 02 pistols &amp; ammunition seized from Indo-Pak border in Abohar sector of Punjab by @BSF_India troops  *More datals awaited#indianarmy #security #force #bsf #crpf #army #policeforce #kashmir #cowardlyattack #militant #threat #jihadist #gernade https://t.co/0mMowzKbzL'",b'JKCHANNEL10',"b'Jammu, India'","['security', 'force', 'bsf', 'crpf', 'army', 'policeforce', 'kashmir', 'cowardlyattack', 'militant', 'threat', 'jihadist', 'gernade']",False,1646
2020-09-12 05:44:55,b'The future has arrived! These explosive #wildfires are #climatechange wakeup call.  #Scientists have been warning of growing #threat of #climatechange in turn those #projections are a reality!#wildfires #ClimateEmergency #ClimateCrisis #ClimateActionNow  https://t.co/bVDMOsbU2Y',b'Gender_Env',"b'Bangkok, Thailand'","['wildfires', 'climatechange', 'Scientists', 'threat', 'climatechange', 'projections', 'wildfires', 'ClimateEmergency', 'ClimateCrisis', 'ClimateActionNow']",False,463
2020-09-12 05:05:33,b'Tipsy stream sipping on that henny Yktv #threat #LaFamilaOT #BeTheThreat https://t.co/v765rOYPaA',b'Aim_Szn',"b'Manhattan, New YorK'","['threat', 'LaFamilaOT', 'BeTheThreat']",False,301
2020-09-12 03:49:46,b'I agree. Seems the  #political #impact of strong state governments overcoming the inertia and #ineffectiveness of the #health bureaucracies to suppress the #pandemic CONTRARY to #federal #policy is a terrifying #threat. Now #corrupt #economic #policy could be  #reformed. #auspol https://t.co/btQdqbxmoS',b'kate_eviva',b'Australia',"['political', 'impact', 'ineffectiveness', 'health', 'pandemic', 'federal', 'policy', 'threat', 'corrupt', 'economic', 'policy', 'reformed', 'auspol']",False,2179
2020-09-12 03:45:05,b'Hey guys I am being blackmailed by this girl on kik. Can anyone please help me.   She is threatening to release my pics on social media \xf0\x9f\x99\x8f  Can anyome help\xf0\x9f\x99\x8f  #blackmailed #girl #threat #threats #threatening #blackmailing #blackmailer #help',b'Jim77858511',b'',"['blackmailed', 'girl', 'threat', 'threats', 'threatening', 'blackmailing', 'blackmailer', 'help']",False,0
2020-09-12 02:17:01,"b'Is not ones against another, is ones WITH Another. Cyberseurity pros are using artificial intelligence but still prefer the human touch #Infosec #CyberSecurity #CyberAttack #Hacking #Privacy #Threat #Cyberwarning #ArtificialIntelligence #AI #Tech #Technology https://t.co/U75hHbzxsb'",b'CioAmaro',b'M\xc3\xa9xico',"['Infosec', 'CyberSecurity', 'CyberAttack', 'Hacking', 'Privacy', 'Threat', 'Cyberwarning', 'ArtificialIntelligence', 'AI', 'Tech', 'Technology']",False,8412
2020-09-11 23:38:08,b'The student sent messages to three teachers threatening violence with weapons in private chats in the #Zoom #virtualclassroom. #schoolshooting #threat #cyber #policefreeschools? Story by @winknews https://t.co/gRhBDux16N',b'K12ssdb',b'',"['Zoom', 'virtualclassroom', 'schoolshooting', 'threat', 'cyber', 'policefreeschools']",False,488
2020-09-11 23:35:01,b'The 2020 Verizon Data Breach Investigations Report: One CISO\xe2\x80\x99s View https://t.co/zaXMo37iHh #Infosec #CyberSecurity #CyberAttack #Hacking #Privacy #Threat #Malware #Ransomware #Cyberwarning #Phishing #SpyWare #Tech #Technology https://t.co/DqAt6XNBR4',b'CioAmaro',b'M\xc3\xa9xico',"['Infosec', 'CyberSecurity', 'CyberAttack', 'Hacking', 'Privacy', 'Threat', 'Malware', 'Ransomware', 'Cyberwarning', 'Phishing', 'SpyWare', 'Tech', 'Technology']",False,8412
2020-09-11 21:09:02,b'Key insider threat risks and questions that are addressed by data visibility sources by RSA #Infosec #CyberSecurity #CyberAttack #Hacking #Privacy #Threat #Malware #Ransomware #Cyberwarning #Phishing #SpyWare #Tech #Technology https://t.co/NQYvq9hqoT',b'CioAmaro',b'M\xc3\xa9xico',"['Infosec', 'CyberSecurity', 'CyberAttack', 'Hacking', 'Privacy', 'Threat', 'Malware', 'Ransomware', 'Cyberwarning', 'Phishing', 'SpyWare', 'Tech', 'Technology']",False,8412
2020-09-11 21:08:28,"b'""After 9/11, any purported #terrorist #threat anywhere purportedly justified the Bush administration\xe2\x80\x99s seizure of boundless power. With the #pandemic, almost all #Covid cases justify #politicians prohibiting almost any type of behavior."" -@JimBovard  @aier https://t.co/3T8t0I0Tcv'",b'UncleNap',b'Once-Free States of America',"['terrorist', 'threat', 'pandemic', 'Covid', 'politicians']",False,322
2020-09-11 20:32:45,"b""Rudolph's Burroughs Wellcome Company in Durham, NC is threatened with demolition - read more on our blog at https://t.co/xyVoqiQKvp or the link in our bio.\xe2\x81\xa0   \xf0\x9f\x93\xb8: @pjmcdonnell_ \xe2\x81\xa0 \xe2\x81\xa0https://t.co/11CK1glGpG \xe2\x81\xa0 #PaulRudolph #THREAT #ALERT #Durham #architecture #save #saveme #stop https://t.co/9INeYTXuhL""",b'PaulRudolphHF',"b'New York, NY'","['PaulRudolph', 'THREAT', 'ALERT', 'Durham', 'architecture', 'save', 'saveme', 'stop']",False,949
2020-09-11 20:11:00,b'#threat landscape mapping by @enisa_eu  #cybersecurity #infosec #modus_operandi https://t.co/3knS7WaHvn',b'ctinnil',b'near',"['threat', 'cybersecurity', 'infosec', 'modus_operandi']",False,65
2020-09-11 19:43:01,b'Adaptive security and visibility by https://t.co/kSaCIMceuM #Infosec #CyberSecurity #CyberAttack #Hacking #Privacy #Threat #Malware #Ransomware #Cyberwarning #Phishing #SpyWare #Tech #Technology #ZeroTrust https://t.co/tMZS92NA40',b'CioAmaro',b'M\xc3\xa9xico',"['Infosec', 'CyberSecurity', 'CyberAttack', 'Hacking', 'Privacy', 'Threat', 'Malware', 'Ransomware', 'Cyberwarning', 'Phishing', 'SpyWare', 'Tech', 'Technology', 'ZeroTrust']",False,8412
2020-09-11 18:42:13,"b""The @Chiefs booing was a political act against #Unity; b/c GOP propaganda rightly informs their constituents, that it's their greatest #Threat. Want to defeat fascism? Seek #Unity where there is #Division. Then don't worry and drive #TurnOut. We win big w/#GOTV and #CountingVotes""",b'GuitarSunCat',"b'Milwaukee, Wi'","['Unity', 'Threat', 'Unity', 'Division', 'TurnOut', 'GOTV', 'CountingVotes']",False,9349
2020-09-11 18:14:17,"b'Let us be clear @Conservatives: the ONE, SINGLE &amp; ONLY #threat to the #Union is the current #UKGovernment, just as it is the biggest threat to the #economy, #SocialStability &amp; #RuleOfLaw https://t.co/WS3nFMQFau'",b'vhb49',b'',"['threat', 'Union', 'UKGovernment', 'economy', 'SocialStability', 'RuleOfLaw']",False,145
2020-09-11 17:14:46,b'What is the future pathway we are on?   #wildlife #biodiversity #threat #conservation   @climateWWF @CITES @UNBiodiversity @JaneGoodallInst @Nature4Climate @nature   https://t.co/x9dO4m2Sj7',b'ResilienceFron1',b'',"['wildlife', 'biodiversity', 'threat', 'conservation']",False,113
2020-09-11 17:03:05,b'Zero Trust Security Framework - Enablis  #Infosec #CyberSecurity #CyberAttack #Hacking #Privacy #Threat #Malware #Ransomware #Cyberwarning #Phishing #SpyWare #Tech #Technology #ZeroTrust https://t.co/MtSxzeKCvP',b'CioAmaro',b'M\xc3\xa9xico',"['Infosec', 'CyberSecurity', 'CyberAttack', 'Hacking', 'Privacy', 'Threat', 'Malware', 'Ransomware', 'Cyberwarning', 'Phishing', 'SpyWare', 'Tech', 'Technology', 'ZeroTrust']",False,8412
2020-09-11 16:54:06,b'Risky business: the shadow of constant threat is changing us | Books | The Guardian  https://t.co/EJEPGvRZAv  #COVID19 #risk #threat',b'GAValueNetwork',b'',"['COVID19', 'risk', 'threat']",False,14
2020-09-11 16:48:58,"b'Prioritize your cybersecurity efforts, and demonstrate reasonable security. https://t.co/5FemT4PhVo #cyber #security #threat #reasonable #breach'",b'halock',"b'Schaumburg, IL'","['cyber', 'security', 'threat', 'reasonable', 'breach']",False,596
2020-09-11 16:48:45,b'@SecPompeo When will the @WhiteHouse make a statement about @SpeakerPelosi #threat to end trade talks and a deal with Her Majesty\xe2\x80\x99s Government? Is it right that this old fraud who got going to the dog parlour is allowed to lecture other states? https://t.co/eKB3DB552k',b'HackneyAbattoir',"b'Hackney, London'",['threat'],False,74
2020-09-11 16:42:36,b'Dr Fauci just said for @realDonaldTrump to downplay the #trumpvirus is a #THREAT! #TrumpIsAKiller #DumpTrump2020 @Mediaite @TheDemCoalition @TheUSASingers @ProjectLincoln @robreiner @SenateGOP @glennkirschner2 @NorskLadyWolf @funder https://t.co/fSCaBURYbm',b'wondermichele',b'',"['trumpvirus', 'THREAT', 'TrumpIsAKiller', 'DumpTrump2020']",False,214
2020-09-11 16:36:43,"b'@WalshFreedom @JoeBiden  is an #Existential #Threat to the Country,The #Ukrain Embezelment ,the #Putin talks,the HunterBiden #China Connection,loads of #CASH to #IRAN ,the #Sexual #Assaults,goes #ON &amp; #ON #DemocratsAreDestroyingAmerica #DemocratsHateAmerica Harris Crooked DA'",b'tommy4usa',b'IOWA The Tall Corn State',"['Existential', 'Threat', 'Ukrain', 'Putin', 'China', 'CASH', 'IRAN', 'Sexual', 'Assaults', 'ON', 'ON', 'DemocratsAreDestroyingAmerica', 'DemocratsHateAmerica']",False,641
2020-09-11 16:29:36,"b'@ShannonTracy123 its Joey #3 .....@JoeBiden  is an #Existential #Threat to the Country,The #Ukrain Embezelment ,the #Putin talks,the HunterBiden #China Connection,loads of #CASH to #IRAN ,the #Sexual #Assaults,goes #ON &amp; #ON #DemocratsAreDestroyingAmerica #DemocratsHateAmerica Harris Crooked DA'",b'tommy4usa',b'IOWA The Tall Corn State',"['Existential', 'Threat', 'Ukrain', 'Putin', 'China', 'CASH', 'IRAN', 'Sexual', 'Assaults', 'ON', 'ON', 'DemocratsAreDestroyingAmerica', 'DemocratsHateAmerica']",False,641
2020-09-11 16:28:04,"b'@iowa_trump @JoeBiden  is an #Existential #Threat to the Country,The #Ukrain Embezelment ,the #Putin talks,the HunterBiden #China Connection,loads of #CASH to #IRAN ,the #Sexual #Assaults,goes #ON &amp; #ON #DemocratsAreDestroyingAmerica #DemocratsHateAmerica Harris Crooked DA'",b'tommy4usa',b'IOWA The Tall Corn State',"['Existential', 'Threat', 'Ukrain', 'Putin', 'China', 'CASH', 'IRAN', 'Sexual', 'Assaults', 'ON', 'ON', 'DemocratsAreDestroyingAmerica', 'DemocratsHateAmerica']",False,641
2020-09-11 16:27:35,"b'@KellyannePolls @JoeBiden the Facts PROVE  @JoeBiden  is an #Existential #Threat to the Country,The #Ukrain Embezelment ,the #Putin talks,the HunterBiden #China Connection,loads of #CASH to #IRAN ,the #Sexual #Assaults,goes #ON &amp; #ON #DemocratsAreDestroyingAmerica #DemocratsHateAmerica #Harris Crooked DA'",b'tommy4usa',b'IOWA The Tall Corn State',"['Existential', 'Threat', 'Ukrain', 'Putin', 'China', 'CASH', 'IRAN', 'Sexual', 'Assaults', 'ON', 'ON', 'DemocratsAreDestroyingAmerica', 'DemocratsHateAmerica', 'Harris']",False,641
2020-09-11 16:24:10,"b'@SenTedCruz the Facts PROVE  @JoeBiden  is an #Existential #Threat to this Country, The #Ukrain Embezelment , the #Putin talks, the HunterBiden #China Connection , Boatloads of #CASH to #IRAN ,the #Sexual #Assaults list goes #ON &amp; #ON #DemocratsAreDestroyingAmerica #DemocratsHateAmerica'",b'tommy4usa',b'IOWA The Tall Corn State',"['Existential', 'Threat', 'Ukrain', 'Putin', 'China', 'CASH', 'IRAN', 'Sexual', 'Assaults', 'ON', 'ON', 'DemocratsAreDestroyingAmerica', 'DemocratsHateAmerica']",False,641
2020-09-11 16:23:45,"b'@dbongino the Facts PROVE  @JoeBiden  is an #Existential #Threat to this Country, The #Ukrain Embezelment , the #Putin talks, the HunterBiden #China Connection , Boatloads of #CASH to #IRAN ,the #Sexual #Assaults list goes #ON &amp; #ON #DemocratsAreDestroyingAmerica #DemocratsHateAmerica'",b'tommy4usa',b'IOWA The Tall Corn State',"['Existential', 'Threat', 'Ukrain', 'Putin', 'China', 'CASH', 'IRAN', 'Sexual', 'Assaults', 'ON', 'ON', 'DemocratsAreDestroyingAmerica', 'DemocratsHateAmerica']",False,641
2020-09-11 16:17:17,"b'@TheDemocrats the Facts PROVE  @JoeBiden  is an #Existential #Threat to this Country, The #Ukrain Embezelment , the #Putin talks, the HunterBiden #China Connection , Boatloads of #CASH to #IRAN ,the #Sexual #Assaults list goes #ON &amp; #ON #DemocratsAreDestroyingAmerica #DemocratsHateAmerica'",b'tommy4usa',b'IOWA The Tall Corn State',"['Existential', 'Threat', 'Ukrain', 'Putin', 'China', 'CASH', 'IRAN', 'Sexual', 'Assaults', 'ON', 'ON', 'DemocratsAreDestroyingAmerica', 'DemocratsHateAmerica']",False,641
2020-09-11 16:10:21,"b'Christian Cooper just wrote a comic LOL.  He is the black guy in the park who THREATENED a white woman and she said she was going to call the police, as she should.  On his facebook he posted ""you aren\'t going to like what I am going to do"".  #threat #blm https://t.co/3nzapyxeQ1'",b'Troll2Trollarmy',b'',"['threat', 'blm']",False,2856
2020-09-11 15:44:02,b'This is the reason why ransomware continues growing #Infosec #CyberSecurity #CyberAttack #Hacking #Privacy #Threat #Malware #Ransomware #Cyberwarning #Phishing #SpyWare #Tech #Technology https://t.co/n6viXyrUCK',b'CioAmaro',b'M\xc3\xa9xico',"['Infosec', 'CyberSecurity', 'CyberAttack', 'Hacking', 'Privacy', 'Threat', 'Malware', 'Ransomware', 'Cyberwarning', 'Phishing', 'SpyWare', 'Tech', 'Technology']",False,8412
2020-09-11 15:15:13,"b""You can't fix it if you can't define it.  Kevin Bocek talks about the importance of creating common language between #threat analysts, #cybersecurity professionals and the #InfoSec community when it comes to protecting #machineidentities.   https://t.co/PF9g1Tb6yx  #encryption https://t.co/PJ1C8eWhI0""",b'Venafi',"b'Utah, USA'","['threat', 'cybersecurity', 'InfoSec', 'machineidentities', 'encryption']",False,5139
2020-09-11 15:01:58,b'#digitalart #illustrations #satire #breakfast #threat #English #British #food #bakedbeans #sausage Retweet and give your interpretation in the replies. https://t.co/XFw0JBIFpX',b'ComicsCapri',b'Stoke-On-Trent',"['digitalart', 'illustrations', 'satire', 'breakfast', 'threat', 'English', 'British', 'food', 'bakedbeans', 'sausage']",False,27
2020-09-11 14:32:09,"b""@TheNationNews For me I don't think to use the word kill to someone else #threat is Godly as a pastor, what do you want us to learn from you.""",b'FantasticBabe9',b'',['threat'],False,2
2020-09-11 14:13:41,"b'@RudyGiuliani @RudyGiuliani is a #liar, #grifter, and a #threat, @realDonaldTrump is a #threat, #rapist, #racist, #pedophile, #GrifterInChief etc, @JoeBiden and #KamalaHarris are all that stand between us and having a #DictatorTrump'",b'Richard37397900',b'',"['liar', 'grifter', 'threat', 'threat', 'rapist', 'racist', 'pedophile', 'GrifterInChief', 'KamalaHarris', 'DictatorTrump']",False,598
2020-09-11 13:55:03,b'IS #RANSOMWARE STILL A #THREAT TO #BUSINESSES?  https://t.co/B1ILT3bohD https://t.co/g18D1IIe7L',b'AMESolutions',"b'Topsham Road, Exeter, Devon'","['RANSOMWARE', 'THREAT', 'BUSINESSES']",False,1417
2020-09-11 13:04:02,"b'Do you not scared? well, you should! Russia Has the Fastest Hackers #Infographic #Infosec #CyberSecurity #CyberAttack #Hack #Breach #Threat #DDoS #Malware #Ransomware #Cyberwarning #Phishing #SpyWare #Tech #Technology https://t.co/RlOD1aMDuW'",b'CioAmaro',b'M\xc3\xa9xico',"['Infographic', 'Infosec', 'CyberSecurity', 'CyberAttack', 'Hack', 'Breach', 'Threat', 'DDoS', 'Malware', 'Ransomware', 'Cyberwarning', 'Phishing', 'SpyWare', 'Tech', 'Technology']",False,8412
2020-09-11 11:59:37,b'WOW! #Bears yes powerful #animals but not #savage #people #killers it\xe2\x80\x99s #humans that are a #threat to the #Bear #Protect them #wildlife #BanTrophyHunting #Nature #matters \xf0\x9f\x90\xbb https://t.co/3joIZOLGwI',b'daffodil_03',b'Wales \xf0\x9f\x8f\xb4\xf3\xa0\x81\xa7\xf3\xa0\x81\xa2\xf3\xa0\x81\xb7\xf3\xa0\x81\xac\xf3\xa0\x81\xb3\xf3\xa0\x81\xbf ',"['Bears', 'animals', 'savage', 'people', 'killers', 'humans', 'threat', 'Bear', 'Protect', 'wildlife', 'BanTrophyHunting', 'Nature', 'matters']",False,196
2020-09-11 11:43:02,b'12 Internet safety Tips to Improve your Security Online - Mirage Portal  #Infosec #CyberSecurity #CyberAttack #Hacking #Privacy #Threat #Malware #Ransomware #Cyberwarning #Phishing #SpyWare #Tech #Technology https://t.co/LPPHRFHhAh',b'CioAmaro',b'M\xc3\xa9xico',"['Infosec', 'CyberSecurity', 'CyberAttack', 'Hacking', 'Privacy', 'Threat', 'Malware', 'Ransomware', 'Cyberwarning', 'Phishing', 'SpyWare', 'Tech', 'Technology']",False,8412
2020-09-11 11:18:49,b'Cyber Resilience or Threat Analyst-jobs-Raleigh-North Carolina #Cyber #Resilience #Threat #Analyst #CyberResilience #cybersecuritythreats #cybersecurityanalyst #Raleigh #NorthCarolina #opentowork #Resume #Lookingforjob #JobOpportun\xe2\x80\xa6https://t.co/U0V0rDz3NQ https://t.co/rDQa6mj6Fw',b'AjayParmar1137',"b'Charlotte, North Carolina USA'","['Cyber', 'Resilience', 'Threat', 'Analyst', 'CyberResilience', 'cybersecuritythreats', 'cybersecurityanalyst', 'Raleigh', 'NorthCarolina', 'opentowork', 'Resume', 'Lookingforjob', 'JobOpportun']",False,1885
2020-09-11 09:31:27,b'Shri Yogi Adityanath ji\xf0\x9f\x99\x8f Please look at the poor management system of colleges. No preventive measures were taken during b. Ed exam conduction. No screening. Life at risk. #NoSocialDistancing #NoScreening #Threat #Corona #UP  #YogiAdityanath #NoPreventiveMeasures #Shame',b'Priyans55153950',b'',"['NoSocialDistancing', 'NoScreening', 'Threat', 'Corona', 'UP', 'YogiAdityanath', 'NoPreventiveMeasures', 'Shame']",False,8
2020-09-11 09:30:00,"b'Did you know that 69% of ATMs are vulnerable to blackbox attacks? These #cyberattacks are commonly seen in #Europe, but pose a real #threat to the rest of the world and are carried out by simple devices, known as black boxes. Check out our #blog for more! https://t.co/igEemz8K88 https://t.co/5gRzPZuxsv'",b'sepiosys',"b'Rockville, Maryland'","['cyberattacks', 'Europe', 'threat', 'blog']",False,296
2020-09-11 09:02:02,"b'As fast as business initiatives evolve, the #threat landscape is evolving even faster. Optiv\xe2\x80\x99s Focused Security Strategy Assessment designs a roadmap to stay ahead. #riskaware https://t.co/NwTesVPuJC https://t.co/NYo57lgX9N'",b'jbird7',"b'Austin, Texas'","['threat', 'riskaware']",False,138
2020-09-11 09:00:16,"b'The move comes after the #NCSC identified a heightened #cyber #threat to the #UK #health sector in relation to the pandemic, with #cybercrime groups attempting to steal sensitive #intelligence, intellectual property. https://t.co/82KGXSHemo via @GOVUK'",b'VDEinstitut',"b'Offenbach am Main, Deutschland'","['NCSC', 'cyber', 'threat', 'UK', 'health', 'cybercrime', 'intelligence']",False,3895
2020-09-11 08:57:22,"b'Grab your copy of Q2 2020 #Seqrite #Threat #Report, one of the most #comprehensive reports on the growing threat landscape within #India and other parts  of the world.   #security #threats #cybersecurity #Seqrite @Seqrite https://t.co/XytbC6VRyK'",b'TechMD2025',b'',"['Seqrite', 'Threat', 'Report', 'comprehensive', 'India', 'security', 'threats', 'cybersecurity', 'Seqrite']",False,148
2020-09-11 08:28:28,b'2/4 The #FLN #MRCD\xe2\x80\x99s army wing claimed responsibility for an attack on passenger buses in Nyungwe forest. The incident led to the deaths of two people and eight others were injured. Still no big enough existential #threat to the Rwandan state? https://t.co/yZ2ziUWh0m',b'KanyanaVanessa',b'',"['FLN', 'MRCD', 'threat']",False,114
2020-09-11 08:19:15,b'Nearly two decades later.  Now there is a different #threat to our #society.  #COVID19 #September11  #BeStrongAgain https://t.co/dBDChWfJYc',b'JohnStanleyTwit',"b'#GreatDunmow, #Essex, England'","['threat', 'society', 'COVID19', 'September11', 'BeStrongAgain']",False,17505
2020-09-11 08:12:33,b'#Threat  Since they have nostril at the tip which makes them more loud while breathing due to plungy nostril. There was no natural predator at the island so they dont cared much about the loudness but now we have introduced dogs and cats.',b'shaheerkhan',"b'Dehradun, India'",['Threat'],False,265
2020-09-11 05:46:42,"b'@RudyGuiliani So is The New World Order, 1% Elites. Rothschilds, Rockefeller, Gates Foundation, Clinton Foundation, Obama, Bushes..you know the rest. #Threat https://t.co/svRanrw4YW'",b'MAGAMuscleMan',b'',['Threat'],False,217
2020-09-11 05:25:46,b'i would put a whole in eric andre chest this is #not a #threat',b'word2ma',b'nj',"['not', 'threat']",False,97
2020-09-11 05:21:48,b'@sgtbetsysmith Anyone who thinks that should be deemed a #criminal and put away for being a #Threat.',b'DanMac2014',b'Canada',"['criminal', 'Threat']",False,2810
2020-09-11 04:57:26,"b'\xe2\x80\x9c\xe2\x81\xa6@realDonaldTrump\xe2\x81\xa9 believes that #China presents an economic #threat to the #American middle class and to our future prosperity as a nation. \xe2\x81\xa6@JoeBiden\xe2\x81\xa9 is a #globalist who ... 1/2  Where Biden, Trump Stand on the Chinese Communist Party #CCP  https://t.co/SJ4lpKxFxA'",b'Terence',b'',"['China', 'threat', 'American', 'globalist', 'CCP']",False,246
2020-09-11 02:54:44,b'@ChhattisgarhCMO @dmawasthi_IPS86 @SPDurg @DurgPoliceCG  The Illegal #Irupee #cashtrain #icredit #snapit #credime #flashrupee #pandarupe  agent 8586052519  #Harrasing women #Threat #abusive @AmitShahOffice @helping_women pls help @RBI @RBIsays no one #nbfc following ur #guideline https://t.co/xF2W1vREoJ',b'EMI02602007',b'',"['Irupee', 'cashtrain', 'icredit', 'snapit', 'credime', 'flashrupee', 'pandarupe', 'Harrasing', 'Threat', 'abusive', 'nbfc', 'guideline']",False,102
2020-09-11 02:17:01,b'Departments or groups in organizations that present the biggest risk for insider threats - Anti Phishing Solution and Awareness Education #Infosec #CyberSecurity #CyberAttack #Hacking #Privacy #Threat #Malware #Cyberwarning #Phishing #Insider #Tech #Technology https://t.co/mju91Hvkjx',b'CioAmaro',b'M\xc3\xa9xico',"['Infosec', 'CyberSecurity', 'CyberAttack', 'Hacking', 'Privacy', 'Threat', 'Malware', 'Cyberwarning', 'Phishing', 'Insider', 'Tech', 'Technology']",False,8412
2020-09-11 00:33:19,"b'@WalshFreedom the Facts PROVE @JoeBiden is an #Existential #Threat to this Country, The #Ukrain Embezelment , the #Putin talks, the HunterBiden #China Connection , Boatloads of #CASH to #IRAN ,the #Sexual #Assaults list goes #ON &amp; #ON #DemocratsAreDestroyingAmerica #DemocratsHateAmerica'",b'tommy4usa',b'IOWA The Tall Corn State',"['Existential', 'Threat', 'Ukrain', 'Putin', 'China', 'CASH', 'IRAN', 'Sexual', 'Assaults', 'ON', 'ON', 'DemocratsAreDestroyingAmerica', 'DemocratsHateAmerica']",False,641
2020-09-11 00:32:51,"b'@glennbeck the Facts PROVE @JoeBiden is an #Existential #Threat to this Country, The #Ukrain Embezelment , the #Putin talks, the HunterBiden #China Connection , Boatloads of #CASH to #IRAN ,the #Sexual #Assaults list goes #ON &amp; #ON #DemocratsAreDestroyingAmerica #DemocratsHateAmerica'",b'tommy4usa',b'IOWA The Tall Corn State',"['Existential', 'Threat', 'Ukrain', 'Putin', 'China', 'CASH', 'IRAN', 'Sexual', 'Assaults', 'ON', 'ON', 'DemocratsAreDestroyingAmerica', 'DemocratsHateAmerica']",False,641
2020-09-11 00:32:12,"b'@EricTrump the Facts PROVE @JoeBiden is an #Existential #Threat to this Country, The #Ukrain Embezelment , the #Putin talks, the HunterBiden #China Connection , Boatloads of #CASH to #IRAN ,the #Sexual #Assaults list goes #ON &amp; #ON #DemocratsAreDestroyingAmerica #DemocratsHateAmerica'",b'tommy4usa',b'IOWA The Tall Corn State',"['Existential', 'Threat', 'Ukrain', 'Putin', 'China', 'CASH', 'IRAN', 'Sexual', 'Assaults', 'ON', 'ON', 'DemocratsAreDestroyingAmerica', 'DemocratsHateAmerica']",False,641
2020-09-11 00:29:59,"b'@GOP @realDonaldTrump the Facts PROVE @JoeBiden is an #Existential #Threat to this Country, The #Ukrain Embezelment , the #Putin talks, the HunterBiden #China Connection , Boatloads of #CASH to #IRAN ,the #Sexual #Assaults list goes #ON &amp; #ON #DemocratsAreDestroyingAmerica #DemocratsHateAmerica'",b'tommy4usa',b'IOWA The Tall Corn State',"['Existential', 'Threat', 'Ukrain', 'Putin', 'China', 'CASH', 'IRAN', 'Sexual', 'Assaults', 'ON', 'ON', 'DemocratsAreDestroyingAmerica', 'DemocratsHateAmerica']",False,641
2020-09-11 00:27:12,"b'the Facts PROVE @JoeBiden is an #Existential #Threat to this Country, The #Ukrain Embezelment , the #Putin talks, the HunterBiden #China Connection , Boatloads of #CASH to #IRAN ,the #Sexual #Assaults list goes #ON &amp; #ON #DemocratsAreDestroyingAmerica #DemocratsHateAmerica https://t.co/YLnXcap407'",b'tommy4usa',b'IOWA The Tall Corn State',"['Existential', 'Threat', 'Ukrain', 'Putin', 'China', 'CASH', 'IRAN', 'Sexual', 'Assaults', 'ON', 'ON', 'DemocratsAreDestroyingAmerica', 'DemocratsHateAmerica']",False,641
